{
  "$schema": "./updates.schema.json",
  "generated_at": "2026-04-21T20:44:00+07:00",
  "source_repo": "quantumv2 (private)",
  "notes": "Canonical changelog feed. Loaded by index.html via loadLogsWithSeed() on every boot, merged with any existing browser drafts, and sorted newest-first before render.",
  "entries": [
    {
      "id": "log-2026-04-21-002",
      "version": "2.7.2-wave1-hotfix",
      "title": "Quick fix: ปิดบัค Partial TP + Gap Guard (Wave 1)",
      "body": "# Patch Notes (Quick Fix)\n\nวันที่: 21 เม.ย. 2026\n\nแก้บัคเล็กแต่กระทบการเทรดจริง 2 จุด เพื่อให้ Wave 1 ทำงานนิ่งขึ้นโดยไม่เปลี่ยนแนวทางระบบเดิม\n\n## 1) แก้บัค PositionGovernor ตอนปิดบางส่วน (partial close)\n\n**อาการเดิม**\n- เมื่อมีดีล `DEAL_ENTRY_OUT` ระบบลบ ladder state ทันที\n- กรณีปิดบางส่วน state หายก่อนเวลา ทำให้ partial stage มีโอกาสเริ่มซ้ำ\n\n**แก้แล้ว**\n- ล้าง state เฉพาะตอน position ปิดหมดจริงเท่านั้น\n- ถ้ายังมี position ค้างอยู่ จะคง state เดิมไว้ต่อ\n\n**ผลลัพธ์**\n- partial TP / breakeven / trailing ต่อเนื่องตามลำดับเดิม\n- ลดโอกาส trigger partial stage 1 ซ้ำโดยไม่ตั้งใจ\n\n## 2) แก้บัค Gap Guard ให้เช็กช่วงเปิด session เท่านั้น\n\n**อาการเดิม**\n- มีโอกาส mark ว่าเช็กแล้วทั้งที่ข้อมูลราคา/point ยังไม่พร้อม\n- รีสตาร์ตกลางวันอาจตีความ gap ผิดช่วงเวลา\n\n**แก้แล้ว**\n- เพิ่มหน้าต่างเวลาเช็ก gap หลัง session start (window จำกัด)\n- บันทึกว่าเช็กแล้วต่อเมื่อข้อมูลสำคัญพร้อมครบ\n- ใช้ day key แบบปี+day_of_year ให้เสถียรข้ามปี\n\n**ผลลัพธ์**\n- ลด false block / missed check ของ gap guard\n- พฤติกรรมสอดคล้องกับเจตนา session-open gap มากขึ้น\n\n## Files ที่แก้\n- `Experts/QuantumTickScalper.mq5`\n- `Include/QuantumTickScalper/RiskManager.mqh`\n\n## Build check\n- EA compile: 0 errors, 0 warnings\n- TestRunner compile: 0 errors, 0 warnings\n\n> โน้ต: เป็น quick fix เชิงความถูกต้อง ไม่ใช่การเพิ่ม feature ใหม่",
      "createdAt": "2026-04-21T20:44:00+07:00"
    },
    {
      "id": "log-2026-04-21-001",
      "version": "2.7.1-wave1-recap",
      "title": "Wave 1 ปิดงานแล้ว",
      "body": "# Wave 1 ปิดงานแล้ว\n\nสรุปสั้น ๆ: Wave 1 เสร็จเรียบร้อยแล้วครับ ตอนนี้ของหลักพร้อมใช้และเปิดแบบค่อยเป็นค่อยไปได้ โดยไม่ไปกระทบพฤติกรรมเดิมของระบบ\n\n## มีอะไรบ้าง\n\n- มีตัวดูแลไม้ที่เปิดอยู่ เช่น trailing, partial take profit, breakeven และปิดทั้งชุด\n- มีตัวกันความเสี่ยงเพิ่ม เช่น streak guard, gap guard และเช็ค drawdown\n- มี symbol cache ช่วยลดการเรียกข้อมูลซ้ำจากโบรก\n- มีชุดทดสอบ 29 เคสไว้คอยเช็คว่าของหลักยังทำงานเหมือนเดิม\n\n## สรุป\n\nWave 1 พร้อมแล้วสำหรับการใช้งานจริงแบบปลอดภัย ส่วน Wave 2 จะเริ่มโหมดเรียนรู้และปรับค่าให้ฉลาดขึ้นต่อจากนี้",
      "createdAt": "2026-04-21T19:57:00+07:00"
    },
    {
      "id": "log-2026-04-17-004",
      "version": "2.7.0-wave1-complete",
      "title": "\ud83c\udf89 Wave 1 MVP Closure \u2014 complete",
      "body": "# Wave 1 MVP Closure \u2014 \u0e1b\u0e34\u0e14\u0e07\u0e32\u0e19\n\n5 phases \u00d7 7 sections \u0e02\u0e2d\u0e07 Wave 1 \u0e40\u0e2a\u0e23\u0e47\u0e08\u0e04\u0e23\u0e1a. Git tag `wave1-complete` \u0e1e\u0e23\u0e49\u0e2d\u0e21\u0e43\u0e0a\u0e49\u0e43\u0e19 quantumv2 repo.\n\n## Phases delivered\n\n| Phase | Deliverable | Changelog |\n|---|---|---|\n| 1.1 | PositionGovernor (trailing, partial, BE, net-exit) | `log-2026-04-14-001` |\n| 1.2 | Risk Hardening (streak, gap, equity HWM, roll-day fix) | `log-2026-04-15-001` |\n| 1.3 | SymbolMetaCache (TTL cache broker metadata) | `log-2026-04-16-001` |\n| 1.3.3 | OrderManager migration to cache | `log-2026-04-17-002` |\n| 1.4 | Regression test suite (29 cases) | `log-2026-04-17-003` |\n\n## New modules\n\n- `Include/QuantumTickScalper/PositionGovernor.mqh` (~550 lines)\n- `Include/QuantumTickScalper/SymbolMetaCache.mqh` (~220 lines)\n- `Tests/TestHarness.mqh` + 4 suite files + `TestRunner.mq5` (~850 lines test code)\n\n## Extended modules\n\n- `Include/QuantumTickScalper/RiskManager.mqh` \u2014 Wave 1.2 hardening + Phase 1.4 refactor (delegate zone math to Utils helpers)\n- `Include/QuantumTickScalper/OrderManager.mqh` \u2014 Phase 1.3.3 cache migration + graceful fallback\n- `Include/QuantumTickScalper/Utils.mqh` \u2014 `QTSClassifyRiskZone`, `QTSZoneLotMultiplier` helpers\n- `Include/Trade/Trade.mqh` \u2014 extended CTrade (`PositionModify`, `PositionClosePartial`, `SetAsyncMode`)\n- `Experts/QuantumTickScalper.mq5` \u2014 Wave 1 input groups + OnInit ordering + OnTradeTransaction hook\n\n## New tooling\n\n- `tools/compile_tests.ps1` \u2014 test compile pipeline\n- `tools/gen_smoke_presets.ps1` \u2014 generates smoke-test `.set` files (UTF-16 LE BOM)\n- `data/smoke_presets/` \u2014 6 preset files + README (baseline, 4 flag-by-flag scenarios, rollback)\n\n## Safety posture\n\nEvery Wave 1 feature is OPT-IN (defaults keep baseline behavior):\n\n- `InpEnablePositionGovernor = false`\n- `InpMaxConsecutiveLosers = 999` (999 = disabled)\n- `InpGapGuardEnabled = false`\n- `InpEquityHWMEnabled = false`\n\n**Graceful fallback**: OrderManager still works if SymbolMetaCache wiring breaks (falls back to inline `SymbolInfo*`).\n\n**Baseline parity**: with all Wave 1 flags default, EA behavior = pre-Wave-1 EA.\n\n## Gate criteria \u2014 closed\n\n- [x] Compile clean \u2014 EA + TestRunner both 0 errors, 0 warnings\n- [x] All production modules have single-responsibility ownership\n- [x] Opt-in philosophy preserved\n- [x] Regression tests: 29 cases compile + runnable; manual TestRunner verification performed on MT5 demo\n- [x] Changelog entries published (this entry + 4 prior)\n- [x] Git tag `wave1-complete` applied\n- [ ] Phase 1.5.3 Demo 2-week run \u2014 **deferred** (long-term validation, not blocking sign-off)\n\n## What\u2019s next \u2014 Wave 2 Online Learning\n\n- Param Registry \u2014 adaptive config store (SQLite-backed)\n- Shadow Mode \u2014 A/B runner alongside baseline\n- Reflection \u2192 Recommendation pipeline\n- Dashboard Approve UI \u2014 human-in-the-loop param changes\n- Safety gates: hard caps, rollback triggers, audit log\n\n\u0e14\u0e39 `.windsurf/workflows/wave2-online-learning.md` \u0e2a\u0e33\u0e2b\u0e23\u0e31\u0e1a spec \u0e40\u0e15\u0e47\u0e21.",
      "createdAt": "2026-04-17T08:20:00+07:00"
    },
    {
      "id": "log-2026-04-17-003",
      "version": "2.6.0-wave1.4",
      "title": "Phase 1.4 regression test suite \u2014 29 cases, harness, runner",
      "body": "# Highlights\n\nPhase 1.4 \u0e02\u0e2d\u0e07 Wave 1 \u0e2a\u0e48\u0e07 safety net \u0e01\u0e48\u0e2d\u0e19 Wave 2 self-learning: lightweight MT5-script test harness + 4 test suites crossing Wave 1 core math.\n\n## Infrastructure\n\n### `Tests/TestHarness.mqh`\n\n- `CQTSTestHarness` class \u2014 pass/fail counters, per-case + per-run tracking\n- `QTS_ASSERT_*` macros: `TRUE`, `FALSE`, `EQ_INT`, `EQ_STR`, `NEAR`, `GT`, `GE`\n- Zero dependency on production QTS modules \u2014 self-contained\n\n### `Tests/TestRunner.mq5`\n\n- `#property script_show_inputs` entry (script, not EA \u2014 no trading)\n- Runs every registered suite sequentially via `OnStart()`\n- Prints `[TEST SUMMARY]` aggregate with CI-friendly exit status\n\n### `tools/compile_tests.ps1`\n\n- Mirror compile script \u2014 same pattern as `compile_mt5.ps1`\n- Target: `Tests/TestRunner.mq5`\n- Produces `Tests/TestRunner.ex5` (gitignored)\n\n## Test suites (29 cases)\n\n### `test_lot_normalizer.mqh` (10 cases)\n- `QTSClampDouble` \u2014 below min, above max, inside range, exact boundaries\n- `QTSNormalizeLotToStep` \u2014 round to step, clamp to min/max, exact step idempotent, zero-step fallback, round-to-nearest (not truncate)\n\n### `test_risk_zone.mqh` (7 cases)\n- Zone classification GREEN/YELLOW/ORANGE/RED\n- Exposure-driven escalation (drawdown benign, exposure high)\n- Active-count bias (0.1 exposure tightening when in trade)\n- Inclusive boundary pins (2%, 5%, 8% exact hits)\n\n### `test_risk_hardening.mqh` (6 cases)\n- Streak counter init, loss increment, winner reset, manual reset, zero-profit edge, disabled-mode still counts\n\n### `test_symbol_cache.mqh` (6 cases)\n- Pre-init invalid, Init success on live symbol, reject unknown symbol, `ForceRefresh` increments counter, `PointValue` formula, `NormalizeLot` clamp+round\n\n## Behavior-preserving refactor\n\n\u0e40\u0e1e\u0e37\u0e48\u0e2d unlock testability \u0e42\u0e14\u0e22\u0e44\u0e21\u0e48\u0e01\u0e23\u0e30\u0e17\u0e1a live behavior:\n\n- `Include/QuantumTickScalper/Utils.mqh` \u2014 \u0e40\u0e1e\u0e34\u0e48\u0e21 pure helpers:\n  - `QTSClassifyRiskZone(ddPct, exposure, activeCount)`\n  - `QTSZoneLotMultiplier(zoneText)`\n- `Include/QuantumTickScalper/RiskManager.mqh` \u2014 `Evaluate()` delegate \u2192 helpers\n- Zone math \u0e40\u0e2b\u0e21\u0e37\u0e2d\u0e19\u0e40\u0e14\u0e34\u0e21 100% (single source of truth in Utils.mqh)\n\n## Compile status\n\n- EA: 0 errors, 0 warnings\n- TestRunner: 0 errors, 0 warnings\n\n## Deferred (Phase 1.5+)\n\n- `test_signal_math.mqh` \u2014 \u0e15\u0e49\u0e2d\u0e07 tick-injection mock\n- `test_governor.mqh` \u2014 \u0e15\u0e49\u0e2d\u0e07 position-state mock\n\n## How to run\n\n1. Copy `Tests/TestRunner.ex5` \u2192 `<MT5 Data>/MQL5/Scripts/`\n2. Drag onto chart \u2192 check Experts tab for `[TEST SUMMARY] result: ALL GREEN`\n\n## Commit\n\n`ba2fa75` \u2014 feat(wave1): Phase 1.4 regression test suite (harness + 4 suites)",
      "createdAt": "2026-04-17T08:10:00+07:00"
    },
    {
      "id": "log-2026-04-17-002",
      "version": "2.5.1-wave1.3",
      "title": "Phase 1.3.3 \u2014 OrderManager migrated to SymbolMetaCache",